snippet,print_page,keywords,section_name,abstract,source,blog,news_desk,pub_date,multimedia,word_count,lead_paragraph,type_of_material,web_url,_id,subsection_name,headline,byline,document_type
"Gambling revenue <LOCATION>Macau</LOCATION>, world's biggest gaming hub, fell year time casinos liberalised <DATE>2001</DATE>, <LOCATION>Beijing</LOCATION> campaign conspicuous spending public officials led decline wealthy players.",null,[],Business Day,null,Reuters,[],None,2015-01-01T23:53:20Z,[],263,"Gambling revenue <LOCATION>Macau</LOCATION>, world's biggest gaming hub, fell year time casinos liberalised <DATE>2001</DATE>, <LOCATION>Beijing</LOCATION> campaign conspicuous spending public officials led decline wealthy players.",News,http://www.nytimes.com/reuters/2015/01/01/business/01reuters-macau-gambling-revenue.html,54a624b07988102023c954d7,null,"{main:<LOCATION>Macau<\/LOCATION> Annual Gambling Revenue Falls First Time Since Casino Liberalisation,print_headline:<LOCATION>Macau<\/LOCATION> Annual Gambling Revenue Falls First Time Since Casino Liberalisation}","{original:By REUTERS,person:[],organization:REUTERS}",article
"<ORGANIZATION>Samsung Electronics Co</ORGANIZATION>. Internet-connected televisions year internally developed operating system Tizen, company's latest attempt boost software power.",null,[],Business Day,null,AP,[],None,2015-01-01T23:38:55Z,[],305,"<ORGANIZATION>Samsung Electronics Co</ORGANIZATION>. Internet-connected televisions year internally developed operating system Tizen, company's latest attempt boost software power.",News,http://www.nytimes.com/aponline/2015/01/01/business/ap-as-skorea-samsung-smart-tv.html,54a621df7988102023c95491,null,"{main:Samsung TVs Use Company's Own Tizen Software,print_headline:Samsung TVs Use Company's Own Tizen Software}","{original:By THE ASSOCIATED PRESS,person:[],organization:THE ASSOCIATED PRESS}",article
"<LOCATION>Singapore</LOCATION>'s economic growth slowed expected fourth quarter manufacturing sector contracted face erratic global demand, raising concerns outlook <DATE>2015</DATE>.",null,[],Business Day,null,Reuters,[],None,2015-01-01T21:50:49Z,[],507,"<LOCATION>Singapore</LOCATION>'s economic growth slowed expected fourth quarter manufacturing sector contracted face erratic global demand, raising concerns outlook <DATE>2015</DATE>.",News,http://www.nytimes.com/reuters/2015/01/01/business/01reuters-singapore-economy-gdp.html,54a607eb7988102023c95265,null,"{main:<LOCATION>Singapore<\/LOCATION>'s Slower-Than-Expected Fourth-Quarter Growth Signals Weaker Outlook 2015,print_headline:<LOCATION>Singapore<\/LOCATION>'s Slower-Than-Expected Fourth-Quarter Growth Signals Weaker Outlook 2015}","{original:By REUTERS,person:[],organization:REUTERS}",article
"Chinese property developer <ORGANIZATION>Kaisa Group Holdings</ORGANIZATION> said it had failed to repay a <MONEY>HK$400 million 33 million pounds</MONEY> loan and warned it may default on more debt, the latest problem to hit the firm amid a downturn in the real estate sector.",null,[],Business Day,null,Reuters,[],None,2015-01-01T21:46:17Z,[],322,"Chinese property developer <ORGANIZATION>Kaisa Group Holdings</ORGANIZATION> said it had failed to repay a <MONEY>HK$400 million 33 million pounds</MONEY> loan and warned it may default on more debt, the latest problem to hit the firm amid a downturn in the real estate sector.",News,http://www.nytimes.com/reuters/2015/01/01/business/01reuters-china-kaisa-group-debt.html,54a607197988102023c95255,null,"{main:<LOCATION>China<\/LOCATION> Developer Kaisa Says Fails to Repay <MONEY>$51 Mln<\/MONEY> Loan, May Default on Others,print_headline:<LOCATION>China<\/LOCATION> Developer Kaisa Says Fails to Repay <MONEY>$51 Mln<\/MONEY> Loan, May Default on Others}","{original:By REUTERS,person:[],organization:REUTERS}",article
"Deals worth nearly <MONEY>$3.5 trillion</MONEY> were announced, a performance favored by low interest rates and high stock prices.",null,"[{is_major:Y,name:subject,rank:1,value:Mergers, Acquisitions Divestitures}]",Business Day,"Deals worth nearly <MONEY>$3.5 trillion</MONEY> were announced, a performance favored by low interest rates and high stock prices.",The New York Times,[],Business,2015-01-01T19:32:44Z,[],525,null,Blog,http://dealbook.nytimes.com/2015/01/01/deal-makers-notched-nearly-3-5-trillion-worth-in-14-best-in-7-years/,54a5e7cc7988102023c94f8e,Dealbook,"{main:Deal Makers Notched Nearly <MONEY>$3.5<\/MONEY> <ORGANIZATION>Trillion Worth<\/ORGANIZATION> in &rsquo;14, Best in 7 Years,print_headline:Deal Makers Notched Nearly <MONEY>$3.5 Trillion<\/MONEY> Worth in \u201914, Best in 7 Years,kicker:DealBook}","{original:By <PERSON>MICHAEL J. DE<\/PERSON> LA MERCED,person:[{firstname:Michael,role:reported,organization:,middlename:J.,rank:1,lastname:DE LA MERCED}]}",blogpost
"<ORGANIZATION>Hyundai Motor Co</ORGANIZATION> affiliate <ORGANIZATION>Kia Motors Corp</ORGANIZATION> forecast sales year grow slowest pace <DATE>2003</DATE>, hampered capacity constraints weaker yen give Japanese rivals edge key markets.",null,[],Business Day,null,Reuters,[],None,2015-01-01T18:11:36Z,[],387,"<ORGANIZATION>Hyundai Motor Co</ORGANIZATION> affiliate <ORGANIZATION>Kia Motors Corp</ORGANIZATION> forecast sales year grow slowest pace <DATE>2003</DATE>, hampered capacity constraints weaker yen give Japanese rivals edge key markets.",News,http://www.nytimes.com/reuters/2015/01/01/business/01reuters-hyundai-motor-kia-motors-sales.html,54a5d48a7988102023c94dd6,null,"{main:Hyundai-Kia See <DATE>2015<\/DATE> Sales Growth Weakest 12 Years,print_headline:Hyundai-Kia See <DATE>2015<\/DATE> Sales Growth Weakest 12 Years}","{original:By REUTERS,person:[],organization:REUTERS}",article
"It's year <LOCATION>Seoul</LOCATION> media communications student Lee Woong-hee finished studies, 26-year-old plans skip class graduation ceremony <DATE>February</DATE> thinks retaining student status finally land...",null,[],Business Day,null,Reuters,[],None,2015-01-01T16:02:56Z,[],778,"It's year <LOCATION>Seoul</LOCATION> media communications student Lee Woong-hee finished studies, 26-year-old plans skip class graduation ceremony <DATE>February</DATE> thinks retaining student status finally land job.",News,http://www.nytimes.com/reuters/2015/01/01/business/01reuters-southkorea-youth-unemployment.html,54a5b63b7988102023c94acb,null,"{main:With Jobs Scarce, South Korean Students Linger Campus,print_headline:With Jobs Scarce, South Korean Students Linger Campus}","{original:By REUTERS,person:[],organization:REUTERS}",article
<LOCATION>Brazil</LOCATION>'s President <PERSON>Dilma Rousseff</PERSON> began term <DATE>Thursday</DATE> vowing rein government spending curb inflation pull <LOCATION>Latin America</LOCATION>'s largest economy four-year slump.,null,[],World,null,Reuters,[],None,2015-01-01T14:39:40Z,[],597,<LOCATION>Brazil</LOCATION>'s President <PERSON>Dilma Rousseff</PERSON> began term <DATE>Thursday</DATE> vowing rein government spending curb inflation pull <LOCATION>Latin America</LOCATION>'s largest economy four-year slump.,News,http://www.nytimes.com/reuters/2015/01/01/world/americas/01reuters-brazil-rousseff.html,54a5a35e7988102023c9487a,Americas,"{main:<LOCATION>Brazil<\/LOCATION>'s Rousseff Vows Budget Cuts, Anti-Corruption Push Second Term,print_headline:<LOCATION>Brazil<\/LOCATION>'s Rousseff Vows Budget Cuts, Anti-Corruption Push Second Term}","{original:By REUTERS,person:[],organization:REUTERS}",article
"He's superhero - tights cape prove it! Steve <PERSON>John Ritter</PERSON>, struggling <LOCATION>New York</LOCATION> actor costumed job posing Captain Avenger movie premiere, walks corner market...and holdup. One smash! boom! pow!",null,[],Movies,null,Internet Video Archive,[],Movies,2015-01-01T12:48:31Z,"[{legacy:{wideheight:126,widewidth:190,wide:images/2014/02/03/movies/video-hero-at-large/video-hero-at-large-thumbWide.jpg},subtype:wide,width:190,type:image,url:images/2014/02/03/movies/video-hero-at-large/video-hero-at-large-thumbWide.jpg,height:126},{legacy:{xlarge:images/2014/02/03/movies/video-hero-at-large/video-hero-at-large-articleLarge.jpg,xlargewidth:600,xlargeheight:338},subtype:xlarge,width:600,type:image,url:images/2014/02/03/movies/video-hero-at-large/video-hero-at-large-articleLarge.jpg,height:338},{legacy:{thumbnail:images/2014/02/03/movies/video-hero-at-large/video-hero-at-large-thumbStandard.jpg,thumbnailwidth:75,thumbnailheight:75},subtype:thumbnail,width:75,type:image,url:images/2014/02/03/movies/video-hero-at-large/video-hero-at-large-thumbStandard.jpg,height:75}]",46,"He's superhero - tights cape prove it! Steve <PERSON>John Ritter</PERSON>, struggling <LOCATION>New York</LOCATION> actor costumed job posing Captain Avenger movie premiere, walks corner market...and holdup. One smash! boom! pow!",Video,http://www.nytimes.com/video/movies/100000003332251/hero-at-large.html,54a588727988102023c94032,null,{"main":"Hero At Large"},"{original:Warner Home Video,person:[{firstname:Warner,role:reported,organization:,middlename:Home,rank:1,lastname:Video}]}",multimedia
"Most money. However, thing, bank entrusted. The bank money part cycle global money market.",null,[],Movies,null,Internet Video Archive,[],Movies,2015-01-01T11:47:19Z,"[{legacy:{wideheight:126,widewidth:190,wide:images/2014/02/03/movies/video-lets-make-money/video-lets-make-money-thumbWide.jpg},subtype:wide,width:190,type:image,url:images/2014/02/03/movies/video-lets-make-money/video-lets-make-money-thumbWide.jpg,height:126},{legacy:{xlarge:images/2014/02/03/movies/video-lets-make-money/video-lets-make-money-articleLarge.jpg,xlargewidth:600,xlargeheight:348},subtype:xlarge,width:600,type:image,url:images/2014/02/03/movies/video-lets-make-money/video-lets-make-money-articleLarge.jpg,height:348},{legacy:{thumbnail:images/2014/02/03/movies/video-lets-make-money/video-lets-make-money-thumbStandard.jpg,thumbnailwidth:75,thumbnailheight:75},subtype:thumbnail,width:75,type:image,url:images/2014/02/03/movies/video-lets-make-money/video-lets-make-money-thumbStandard.jpg,height:75}]",43,"Most money. However, thing, bank entrusted. The bank money part cycle global money market.",Video,http://www.nytimes.com/video/movies/100000003349602/lets-make-money.html,54a57a2579881011bed2cfb1,null,{"main":"Let's Make Money"},"{original:Allegro Films,person:[{firstname:Allegro,role:reported,organization:,rank:1,lastname:Films}]}",multimedia
